{
  "index_version": "1.1.0",
  "phase": "PHASE_3B3A_DISCOVERY_ONLY",
  "training_use_prohibited": true,
  "prediction_target_status": "PENDING_EVIDENCE_REVIEW",
  "additional_candidate_count": 6,
  "candidates": [
    {
      "candidate_id": "candidate-dswd-dromic-2019-06-24-caloocan",
      "registry_event_id": "caloocan-flood-candidate-2019-06-24",
      "event_cluster_id": "caloocan-2019-06-24-localized-flooding",
      "hazard_type": "FLOOD",
      "event_window": {
        "start": "2019-06-24",
        "end": null,
        "precision": "CALENDAR_DATE_ONLY_EVENT_TIMES_UNRESOLVED",
        "report_issue_used_as_event_time": false
      },
      "official_source": "Flooding Incident in Caloocan City [24 Jun 2019] [Terminated]",
      "agency": "DSWD DROMIC",
      "source_id": "dswd_dromic_caloocan_flood_2019-06-24",
      "source_reference": "https://dromic.dswd.gov.ph/flooding-incident-in-caloocan-city-24-june-2019/",
      "official_incident_page": "https://dromic.dswd.gov.ph/flooding-incident-in-caloocan-city-24-june-2019/",
      "official_document_links": [
        {
          "url": "https://dromic.dswd.gov.ph/wp-content/uploads/2019/06/DSWD-DROMIC-Report-1-on-the-Flooding-Incident-in-Caloocan-City-as-of-28-June-2019-6PM.docx",
          "title": "DSWD DROMIC Report #1 on the Flooding Incident in Caloocan City",
          "report_issue_time_source_text": "as of 28 June 2019, 6PM",
          "access_status": "AVAILABLE_FOR_ACQUISITION"
        },
        {
          "url": "https://dromic.dswd.gov.ph/wp-content/uploads/2019/06/DSWD-DROMIC-Terminal-Report-on-the-Flooding-Incident-in-Caloocan-City-08-Jul-2019-7PM.docx",
          "title": "DSWD DROMIC Terminal Report on the Flooding Incident in Caloocan City",
          "report_issue_time_source_text": "08 July 2019, 7PM",
          "access_status": "AVAILABLE_FOR_ACQUISITION"
        }
      ],
      "source_classification": "PRIMARY_OFFICIAL_GOVERNMENT",
      "source_status": "ACQUIRED",
      "document_access_status": "AVAILABLE_FOR_ACQUISITION",
      "location_wording": "Portions of Caloocan City; Barangay 175; Barangay 176; Barangay 177; Barangay 178",
      "supported_barangays": ["Barangay 175", "Barangay 176", "Barangay 177", "Barangay 178"],
      "location_precision": "MULTI_BARANGAY",
      "barangay_mapping_status": "LEGACY_BARANGAY_176_REQUIRES_REVIEW",
      "legacy_barangay_176_remapped": false,
      "evidence_summary": "Acquired DSWD DROMIC reports explicitly identify flooding in portions of Caloocan City on 24 June 2019 and name Barangays 175, 176, 177, and 178.",
      "uncertainties": ["Exact onset and cessation are unresolved.", "Legacy Barangay 176 has not been mapped to current split barangays."],
      "label_status": "UNKNOWN",
      "negative_evidence_basis": null,
      "spatial_mapping_status": "UNKNOWN_SPATIAL_MAPPING",
      "review_status": "REQUIRES_HUMAN_REVIEW",
      "training_eligible": false,
      "imerg_historical_availability": "WITHIN_KNOWN_1998_PRESENT_COVERAGE_METADATA_ONLY",
      "priority_criteria": {
        "official_government_source": true,
        "caloocan_explicit": true,
        "flooding_explicit": true,
        "event_date_supported": true,
        "event_timing_available": false,
        "location_detail_available": true,
        "multiple_official_reports": true,
        "source_documents_accessible": true,
        "independent_from_june_2019": false,
        "imerg_historical_availability": true
      },
      "priority_score": 8,
      "acquisition_priority": "HIGH_PRIORITY",
      "secondary_corroboration": [],
      "phase_3b3b_acquisition_selected": false,
      "notes": "Phase 3B2 evidence is already acquired; priority does not change the UNKNOWN label or authorize training."
    },
    {
      "candidate_id": "candidate-ndrrmc-2011-09-27-pedring-caloocan",
      "registry_event_id": "caloocan-flood-candidate-2011-09-27-pedring",
      "event_cluster_id": "caloocan-2011-09-27-pedring-metro-flooding",
      "hazard_type": "FLOOD",
      "event_window": {
        "start": "2011-09-27",
        "end": "2011-09-30",
        "precision": "OFFICIAL_DATE_RANGE_NO_ONSET_OR_CESSATION_TIME",
        "report_issue_used_as_event_time": false
      },
      "official_source": "NDRRMC SitRep No. 12, Effects of Typhoon Pedring",
      "agency": "NDRRMC/OCD",
      "source_id": "ndrrmc_pedring_sitrep12_2011",
      "source_reference": "https://ndrrmc.gov.ph/attachments/article/1748/SitRep_No_12_re_Effects_of_Typhoon_PEDRING_as_of_30SEP2011_1800H.pdf",
      "official_incident_page": null,
      "official_document_links": [
        {
          "url": "https://ndrrmc.gov.ph/attachments/article/1748/SitRep_No_12_re_Effects_of_Typhoon_PEDRING_as_of_30SEP2011_1800H.pdf",
          "title": "NDRRMC SitRep No. 12 re Effects of Typhoon Pedring",
          "report_issue_time_source_text": "as of 30 September 2011, 6:00 PM",
          "access_status": "AVAILABLE_FOR_ACQUISITION"
        }
      ],
      "source_classification": "PRIMARY_OFFICIAL_GOVERNMENT",
      "source_status": "PROPOSED",
      "document_access_status": "AVAILABLE_FOR_ACQUISITION",
      "location_wording": "Cities of Malabon, Caloocan, Manila, Makati, Mandaluyong, Valenzuela, Pasay, Navotas, and Marikina; flooding (Metro-wide), 27-30 September",
      "supported_barangays": [],
      "location_precision": "CITY",
      "barangay_mapping_status": "NO_BARANGAY_STATED_FOR_CALOOCAN_FLOOD_ENTRY",
      "legacy_barangay_176_remapped": false,
      "evidence_summary": "The official incident table explicitly includes Caloocan in a Metro-wide flooding entry dated 27-30 September 2011.",
      "uncertainties": ["The entry aggregates several NCR cities.", "No Caloocan barangay, onset time, cessation time, or depth is stated for the flooding entry."],
      "label_status": "UNKNOWN",
      "negative_evidence_basis": null,
      "spatial_mapping_status": "UNREVIEWED",
      "review_status": "REQUIRES_HUMAN_REVIEW",
      "training_eligible": false,
      "imerg_historical_availability": "WITHIN_KNOWN_1998_PRESENT_COVERAGE_METADATA_ONLY",
      "priority_criteria": {
        "official_government_source": true,
        "caloocan_explicit": true,
        "flooding_explicit": true,
        "event_date_supported": true,
        "event_timing_available": false,
        "location_detail_available": false,
        "multiple_official_reports": false,
        "source_documents_accessible": true,
        "independent_from_june_2019": true,
        "imerg_historical_availability": true
      },
      "priority_score": 7,
      "acquisition_priority": "MEDIUM_PRIORITY",
      "secondary_corroboration": [],
      "phase_3b3b_acquisition_selected": false,
      "notes": "City-level discovery evidence only; human review must determine whether the aggregate entry is sufficiently specific."
    },
    {
      "candidate_id": "candidate-ndrrmc-2012-08-07-gener-haikui-caloocan",
      "registry_event_id": "caloocan-flood-candidate-2012-08-07-gener-haikui",
      "event_cluster_id": "caloocan-2012-08-07-gener-haikui-southwest-monsoon",
      "hazard_type": "FLOOD",
      "event_window": {
        "start": "2012-08-07",
        "end": "2012-08-08",
        "precision": "OFFICIAL_OBSERVATION_DATES_NOT_ONSET_OR_CESSATION",
        "report_issue_used_as_event_time": false
      },
      "official_source": "NDRRMC SitReps on Southwest Monsoon enhanced by Tropical Storm Haikui/Gener",
      "agency": "NDRRMC/OCD",
      "source_id": "ndrrmc_swm_gener_haikui_sitreps_2012",
      "source_reference": "https://ndrrmc.gov.ph/attachments/article/2051/SitRep_No_02_re_Effects_of_Southwest_Monsoon_Enhanced_by_Tropical_Storm_HAIKUI_as_of_7AUG2012_1700H.pdf",
      "official_incident_page": null,
      "official_document_links": [
        {
          "url": "https://ndrrmc.gov.ph/attachments/article/2051/SitRep_No_02_re_Effects_of_Southwest_Monsoon_Enhanced_by_Tropical_Storm_HAIKUI_as_of_7AUG2012_1700H.pdf",
          "title": "NDRRMC SitRep No. 2 re Southwest Monsoon enhanced by Tropical Storm Haikui/Gener",
          "report_issue_time_source_text": "as of 07 August 2012, 5:00 PM",
          "access_status": "AVAILABLE_FOR_ACQUISITION"
        },
        {
          "url": "https://ndrrmc.gov.ph/attachments/article/2051/SitRep_No_03_re_Effects_of_Southwest_Monsoon_Enhanced_by_Tropical_Storm_HAIKUI_as_of_8AUG2012_0700H.pdf",
          "title": "NDRRMC SitRep No. 3 re Southwest Monsoon enhanced by Tropical Storm Haikui/Gener",
          "report_issue_time_source_text": "as of 08 August 2012, 7:00 AM",
          "access_status": "AVAILABLE_FOR_ACQUISITION"
        }
      ],
      "source_classification": "PRIMARY_OFFICIAL_GOVERNMENT",
      "source_status": "PROPOSED",
      "document_access_status": "AVAILABLE_FOR_ACQUISITION",
      "location_wording": "Caloocan City: Bonifacio Monument Circle; 10 Ave bound to City Hall; Dagat-dagatan; not passable to light vehicles due to flooding",
      "supported_barangays": [],
      "location_precision": "STREET_OR_LOCALITY",
      "barangay_mapping_status": "NO_BARANGAY_INFERRED_FROM_STREET_OR_LOCALITY",
      "legacy_barangay_176_remapped": false,
      "evidence_summary": "Official NDRRMC road-status tables explicitly place flooding at three named Caloocan locations on 7-8 August 2012.",
      "uncertainties": ["Report as-of times are not onset or cessation times.", "No barangay identifiers or event depth are stated for the Caloocan rows."],
      "label_status": "UNKNOWN",
      "negative_evidence_basis": null,
      "spatial_mapping_status": "UNREVIEWED",
      "review_status": "REQUIRES_HUMAN_REVIEW",
      "training_eligible": false,
      "imerg_historical_availability": "WITHIN_KNOWN_1998_PRESENT_COVERAGE_METADATA_ONLY",
      "priority_criteria": {
        "official_government_source": true,
        "caloocan_explicit": true,
        "flooding_explicit": true,
        "event_date_supported": true,
        "event_timing_available": false,